{"capability_version":"1.0.0","composition_digest":"de58de48ff39211fe6ae1facd8701618295be0ac1508f87f4cbe17cf50d1ad53","dsl_version":"codestrata.io/rules/v1","ordered_composition":[{"digest":"e36232ee3bea599c7af6186d59224a5528b630dd48ee588bb5f721523d91b2ad","id":"codestrata.engineering-health","version":"1.0.0"}],"resolver_version":"1.0.0","root_digest":"9b34dd71d33cff811ba68c7a3dff908b6523926f245bfd7740764f8a6711d86e","rules":[{"adoption":"recommended","default_enabled":true,"digest":"b97b6d9fd8a443164020dc972219c3dc5a109cba22e50e71f56803e24a7a696c","parameters":{"max_cycle_length":4},"revision":"1.0.0","rule_id":"architecture.dependency-cycle","severity_override":"high"}],"ruleset_id":"codestrata.engineering-standard","ruleset_version":"1.0.0","schema_name":"codestrata.composed-ruleset.v1","schema_version":"1.0.0","selectors":[{"digest":"70a25cbad957f9590a5a68e9b947547416a08b6230f8fb00032287b6f794f11c","id":"codestrata.production_modules","nodes":{"all":[{"type":"module"},{"generated":false}]},"source":"repository_graph"}]}
